Nom,Prix,Description,Isbn,Photo,Editeur,Categorie
"Correspondance, écrits et entretiens I, II: Coffret deux volumes",17.53,"Si l&#39oeuvre de Maurice Ravel (1875-1937) est l&#39une des plus jouées au monde, sa correspondance et ses écrits sur la musique n&#39en demeurent pas moins méconnus. Épistolier paresseux selon la rumeur, l&#39auteur du Bolero a pourtant laissé quelque deux mille lettres et cartes, et pas moins de cent quarante-sept écrits, dont notamment vingt-huit articles et quatre-vingts entretiens. Réunis patiemment par Manuel Cornejo pendant plus d&#39un quart de siècle, ces textes apportent un éclairage indispensable sur la vie et l&#39oeuvre du compositeur. Concision du propos, sens de l&#39humour, élégance d&#39une plume qui ne rechigne pourtant pas à recourir à l&#39argot... Au fil des pages, c&#39est dans l&#39univers de Ravel que nous sommes invités à pénétrer, à peu près comme lorsqu&#39on passe les portes de sa maison du Belvédère à Montfort-l&#39Amaury. Ses valeurs et ses convictions, ses doutes et ses espoirs, son perfectionnisme, son amour de la nature et des animaux, ses goûts musicaux mais aussi littéraires - de Poe à Alain-Fournier en passant par Mallarmé - nous sont ainsi révélés à travers une voix dont les phonographes n&#39ont pas a priori gardé la trace, mais qui ressuscite ici dans toute sa vérité.",978-2073111111,https://m.media-amazon.com/images/I/61KuaDyfL8L._SX342_SY445_.jpg,GALLIMARD (13 mars 2025),Correspondances et memoires
Shaolin Spirit: La voie de la sagesse et de la maîtrise de soi,5.28,"« Il y a deux erreurs sur le chemin du succès : ne pas prendre le départ
et ne pas aller jusqu&#39au bout. »",978-2036070059,https://m.media-amazon.com/images/I/717l13fpHJL._SY522_.jpg,Larousse (9 octobre 2024),Correspondances et memoires
Autocratie(s): Quand les dictateurs s&#39associent pour diriger le monde,11.71,,978-2246834113,https://m.media-amazon.com/images/I/81ouKezQISL._SY522_.jpg,Grasset (15 janvier 2025),Correspondances et memoires
Notre guerre quotidienne,6.88,"Notre guerre quotidienne est un texte exceptionnel : c&#39est la suite du Journal d&#39une invasion, la chronique de l&#39invasion russe tenue par le grand écrivain ukrainien Andreï Kourkov. Entre août 2022 et février 2024, il raconte de l&#39intérieur le combat des Ukrainiens pour sauver leur pays. Dix ans après l&#39annexion de la Crimée, deux ans après l&#39invasion de l&#39Ukraine, Kourkov montre les tentatives de la Russie, depuis plusieurs siècles déjà, pour détruire la culture ukrainienne, c&#39est-à-dire la culture d&#39un peuple résolument tourné vers l&#39Europe. Qu&#39il parle du stress extrême des habitants face aux raids aériens, de la déportation des citoyens des régions occupées, de la corruption éhontée de certains membres du gouvernement ukrainien, du rôle de Zelensky, des crowdfundings pour soutenir l&#39armée ou des festivités de Halloween, Kourkov nous donne à voir le quotidien d&#39un peuple en guerre. Un quotidien parfois absurde, marqué par la résistance, la solidarité et une détermination sans faille. Écrit sur un ton tour à tour mordant, tragique ou humoristique, toujours sincère, Notre guerre quotidienne nous permet de mieux comprendre les enjeux du conflit ¿ mais aussi la manière dont il est vécu, au jour le jour, par la population.",978-2889830824,https://m.media-amazon.com/images/I/81r+xEPNsZL._SY522_.jpg,NOIR BLANC (6 février 2025),Correspondances et memoires
Condition de l&#39homme moderne,16.96,,978-2253101321,https://m.media-amazon.com/images/I/41bE08cEs0L._SY445_SX342_.jpg,Le Livre de Poche (21 octobre 2020),Correspondances et memoires
Vous ne détestez pas le lundi ...: ... Mais vous détestez la domination au travail,10.77,"En France, comme ailleurs, le mal-être au travail s’amplifie. Les travailleurs expriment leur mécontentement face à l’organisation, à l’utilité perçue et à la reconnaissance hiérarchique de leur entreprise. Tous les secteurs, y compris l’associatif et le service public, sont désormais contaminés par des formes de management absurdes et violentes qui font redouter le lundi matin.
En réponse à ce désenchantement, le patronat et le gouvernement optent pour l’indignation et la contrainte : plus d’arrêts maladie ? Imposons des jours de carence. Les démissions se multiplient ? Coupons les allocations chômage. Cette souffrance conduit à une mise au travail forcée.
Vous ne détestez pas le lundi est une invitation à se libérer des mythes du travail : présentéisme, mérite, psychologisation de la souffrance. Ce manuel de développement collectif propose une nouvelle culture de la révolte, capable de légitimer et de soulager les souffrances individuelles en faveur d’une insurrection globale, ancrée dans le réel.",979-1020923561,https://m.media-amazon.com/images/I/51nAQ9HGQNL._SY522_.jpg,Les Liens qui Libèrent (2 octobre 2024),Correspondances et memoires
"Chère Mamie, tu vas rire...",15.95,"Ce matin, la maîtresse nous a emmenés au musée à Bordeaux. C’était génial, enfin pas les peintures moches, mais de prendre le bus. Il y avait un cendrier argenté accroché au siège, et dedans j’ai trouvé un chewing-gum usagé. Je ne sais pas ce qui m’a pris, je l’ai attrapé et j’ai commencé à le malaxer comme de la pâte à modeler. J’ai fait une boule, un serpent, un coeur, puis j’ai fini par un chapeau. Un tout petit mignon chapeau vert. Ah ça, tu m’aurais vue, j’étais fière de moi avec mon tout petit mignon chapeau vert posé sur ma tête. Tu le savais, toi, que le seul moyen d’enlever le chewing-gum sur les cheveux, c’est de les couper ? Papa dit que je ressemble à un playmobil.
Gros bisous à toi et à papy.
Ginie
Les Maisons de Vincent est une association qui développe des lieux de vie – adossés à l’agroécologie – pour adultes autistes. www.maisonsdevincent.com",978-2253248804,https://m.media-amazon.com/images/I/718eXlicKiL._SY522_.jpg,Le Livre de Poche; Illustrated édition (22 novembre 2023),Correspondances et memoires
Code Source: Mes débuts,14.8,"Le récit des débuts de l&#39un des entrepreneurs et philanthropes les plus influents et révolutionnaires de notre temps. Code source ne porte pas sur l&#39âge d&#39or de Microsoft, ni sur la création de la Fondation Gates, ni sur l&#39avenir de la technologie. Il s&#39agit du récit personnel de ce qui a fait de Bill Gates l&#39homme qu&#39il est aujourd&#39hui : son enfance, ses premières passions, ses premiers engagements. C&#39est l&#39histoire d&#39une grand-mère pétrie de principes, de parents ambitieux, de ses premières grandes amitiés et de la mort subite de son meilleur ami ; de sa lutte pour s&#39intégrer, de sa découverte du monde du codage et des ordinateurs à l&#39aube d&#39une nouvelle ère ; de son adolescence, depuis ses escapades nocturnes dans un centre informatique jusqu&#39à la résidence universitaire où il a déclenché une révolution qui allait changer la face du monde. Cette histoire, son histoire, Bill Gates la raconte pour la première fois dans un livre éclairant et sincère, nous dévoilant une fascinante destinée américaine.",978-2080470522,https://m.media-amazon.com/images/I/71lr2BhaoyL._SY522_.jpg,FLAMMARION; Illustrated édition (4 février 2025),Correspondances et memoires
Correspondance: (1944-1959),15.71,"""Tu es entrée, par hasard, dans une vie dont je n&#39étais pas fier, et de ce jour-là quelque chose a commencé de changer. J&#39ai mieux respiré, j&#39ai détesté moins de choses, j&#39ai admiré librement ce qui méritait de l&#39être. Avant toi, hors de toi, je n&#39adhérais à rien. Cette force, dont tu te moquais quelquefois, n&#39a jamais été qu&#39une force solitaire, une force de refus. Avec toi, j&#39ai accepté plus de choses. J&#39ai appris à vivre. C&#39est pour cela sans doute qu&#39il s&#39est toujours mêlé à mon amour une gratitude immense."" Pendant quinze ans, Albert Camus et Maria Casarès échangent des lettres où jaillit toute l&#39intensité de leur amour. Entre la déchirure des séparations et les élans créateurs, cette correspondance met en lumière l&#39intimité de deux monstres sacrés au sommet de leur art.",978-2072873409,https://m.media-amazon.com/images/I/41e2QExEb+L._SY445_SX342_.jpg,Folio (1 janvier 2020),Correspondances et memoires
Le Sacré et le Profane,19.8,"""Le sacré et le profane constituent deux modalités d&#39être dans le monde, deux situations existentielles assumées par l&#39homme au long de son histoire. Ces modes d&#39être dans le Monde n&#39intéressent pas uniquement l&#39histoire des religions ou la sociologie, ils ne constituent pas uniquement l&#39objet d&#39études historiques, sociologiques, ethnologiques. En dernière instance, les modes d&#39être sacré et profane dépendent des différentes positions que l&#39homme a conquises dans le Cosmos ; ils intéressent aussi bien le philosophe que tout chercheur désireux de connaître les dimensions possibles de l&#39existence humaine."" Mircea Eliade.",978-2070324545,https://m.media-amazon.com/images/I/519kJkw3XlL._SY445_SX342_.jpg,FOLIO ESSAIS (1 janvier 1987),Correspondances et memoires
La gratitude,19.59,"Entre récit personnel et essai philosophique, Laetitia Strauch-Bonart pose les jalons d&#39une pensée de droite renouvelée pour le xxie siècle, à la fois attachée au passé et ancrée dans le présent. Depuis son enfance marquée par l&#39absence d&#39un père jusqu&#39à sa découverte du conservatisme britannique, elle retrace son cheminement intellectuel vers la droite libérale-conservatrice. De Jean-Claude Michéa qui fut son premier maître à penser au philosophe Roger Scruton qui devint son mentor, en passant par les aristocrates libéraux de la Révolution française, Chateaubriand, Guizot, Tocqueville, Raymond Aron, Friedrich Hayek ou encore Thomas Sowell, elle dialogue avec les grandes figures de la pensée libérale-conservatrice pour forger sa propre voie. À travers ce parcours intime et intellectuel, l&#39auteure esquisse une histoire subjective des droites françaises, de la Révolution à nos jours, et développe une vision politique qui promeut, en lieu et place de la facilité du ressentiment, le chemin de la gratitude - envers la liberté et la prospérité dont nous avons hérité, envers les institutions qui nous protègent, envers nos attachements particuliers, de la famille à la nation. Un livre ambitieux qui donne à la pensée de droite un visage à la fois exigeant et humain. Une réflexion nécessaire qui s&#39adresse à tous ceux qui s&#39interrogent sur ce que signifie être de droite aujourd&#39hui.",979-1032934180,https://m.media-amazon.com/images/I/31z58lGVRYL.jpg,L&#39OBSERVATOIRE (12 février 2025),Correspondances et memoires
Noces suivi de L&#39Été,12.75,"Je me souviens du moins d&#39une grande fille magnifique qui avait dansé tout l&#39après-midi. Elle portait un collier de jasmin sur sa robe bleue collante, que la sueur mouillait depuis les reins jusqu&#39au jambes. Elle riait en dansant et renversait la tête. Quand elle passait près des tables, elle laissait après elle une odeur mêlée de fleurs et de chair.",978-2070360161,https://m.media-amazon.com/images/I/41Nho5ayp4L._SY445_SX342_.jpg,FOLIO (27 janvier 1972),Correspondances et memoires
Une sacrée envie de foutre le bordel: Entretiens avec Jean-Louis Missika,14.59,"Des entrepreneurs qui ont fait fortune en partant de zéro, il n&#39y en a pas beaucoup en France. Un enfant de Créteil qui n&#39a pas fait d&#39études, qui a fait de la prison et qui est devenu milliardaire, vous pouvez chercher, il n&#39y en a pas d&#39autre. Ceci n&#39est ni une autobiographie, ni une interview. C&#39est une conversation entre amis qui raconte un homme, ses choix, ses regrets, ses espoirs. C&#39est l&#39histoire d&#39une réussite et du parcours invraisemblable qui y mène.",978-2080452146,https://m.media-amazon.com/images/I/61do+xif7RL._SY522_.jpg,FLAMMARION (25 septembre 2024),Correspondances et memoires
Le noeud démocratique: Aux origines de la crise néolibérale,5.3,"Le désenchantement du monde n&#39avait pas livré tous ses secrets. Il comportait une suite que l&#39on n&#39attendait pas. On le croyait achevé. Il n&#39en était rien. Il est allé silencieusement à son terme au cours des quatre ou cinq dernières décennies. La sortie de la structuration religieuse des sociétés a libéré cette fois toutes ses potentialités en engendrant un ""nouveau monde"" déconcertant. L&#39étrange crise de la démocratie qui affecte le monde occidental en est un des aspects les plus troublants. Elle est l&#39opposé exact de la crise totalitaire qui a ravagé le premier XXᵉ siècle. Celle-ci avait pour moteur l&#39aspiration à détruire la démocratie dite ""bourgeoise"" pour lui substituer des régimes supérieurs. La crise actuelle, à l&#39inverse, touche une démocratie dont les principes sont plébiscités, mais dont le fonctionnement n&#39en suscite pas moins une immense frustration et des fractures profondes au sein des peuples. Cette ""crise de la réussite"", comme il y eut un ""vertige du succès"" stalinien, est liée, montre Marcel Gauchet, à une lecture trompeuse de la nouvelle structuration collective née de l&#39effacement complet de l&#39empreinte sacrale. Elle induit une vision réductrice de la nature de la démocratie, aveugle au noeud qui tient ses éléments ensemble. Il faut la dire ""néolibérale"", dans un sens qui va bien au-delà de l&#39économie, même si elle consacre le règne de l&#39économie, puisqu&#39elle concerne tous les domaines de l&#39existence collective et en propose même un modèle global. Mais à l&#39exemple de l&#39expérience totalitaire en son temps, cette expérience qui en prend le contrepied a la vertu de mettre en lumière des conditions jusqu&#39alors mal identifiables de la bonne marche de nos régimes. C&#39est en fonction de ses enseignements que devra se repenser la démocratie de l&#39avenir.",978-2073085313,https://m.media-amazon.com/images/I/71KY9oKOx5L._SY522_.jpg,GALLIMARD (10 octobre 2024),Correspondances et memoires
Mémoires d&#39une jeune fille rangée,8.4,Nouvelle édition en 2008,978-2070355525,https://m.media-amazon.com/images/I/41a5Je6XcWL._SY445_SX342_.jpg,FOLIO (10 janvier 2008),Correspondances et memoires
