Nom,Prix,Description,Isbn,Photo,Editeur,Categorie
Mademoiselle Déjazet,14.05,"Treizième enfant d’une famille modeste, Virginie Déjazet débute sur les planches à l’âge de cinq ans. Le succès semble rapidement lui sourire, mais la presse et les rivalités sont redoutables sur le célèbre Boulevard du Crime…
Femme de tête et femme de cœur, elle se forge une devise ""Bien faire et laisser dire"". Mais la course à l’amour fou et au succès n’est pas sans écueils. Comment rester soi-même dans un milieu où la concurrence est rude et se joue dans le lit des directeurs de théâtre ?
Le rideau n’attend plus que vous pour se lever sur l’histoire vraie de Virginie Déjazet, la petite comédienne qui côtoya Rachel, Sarah Bernhardt et toute l’élite intellectuelle de son temps, avant d’être balayée par les soubresauts d’un siècle tourmenté.",978-2957252107,https://m.media-amazon.com/images/I/716FfftHrGL._SY522_.jpg,,Biographies
Respire Encore: Le souffle de la résilience,10.42,,979-1041562213,https://m.media-amazon.com/images/I/71G7ivVoCXL._SY522_.jpg,Autoédité (23 janvier 2025),Biographies
Quand arrivent les chevaux,12.44,"« Mon p’tit rat, J’espère que toutes mes histoires ne te perturbent pas trop et que tu commences à sentir le passage de mon âme vers la tienne. Je m’y suis préparée. Je sais que, pour toi, c’est un choc, mais il faut calmer le jeu, c’est pas la fin du monde, bien au contraire. C’est un grand rendez-vous que nous avons, toi et moi, mon rat. Je dois tout mettre en ordre de mon côté, j’y suis presque. Mais toi, tu as des choses à faire, si tu veux bien me faire confiance. »",978-2213701516,https://m.media-amazon.com/images/I/71h73D5HANL._SY522_.jpg,Fayard (15 janvier 2025),Biographies
Plus rien ne pourra me blesser: Maîtrisez votre esprit et défiez le destin,18.45,"Pour David Goggins, l&#39enfance a été un cauchemar - pauvreté, préjugés raciaux et violences familiales ont ponctué ses jours et hanté ses nuits. Jeune homme dépressif, en surpoids et sans aucun avenir à l&#39horizon, incapable de courir sur plus de 500 mètres, il va pourtant choisir de prendre son destin en main. Grâce à une force de caractère hors du commun, une discipline extrême et un travail acharné, il va se métamorphoser en une icône des forces armées américaines.
Seul homme de l&#39histoire à avoir été breveté Navy SEAL, Ranger de l&#39armée de terre et contrôleur aérien tactique., il a par la suite établi de nombreux records d&#39endurance dans le domaine des ultra-marathons, au point d&#39être proclamé ""l&#39homme le plus en forme des Etats-Unis"" par Outside Magazine.
En partageant son histoire, David Goggins partage également les échecs et les difficultés qui ont émaillé sa vie mais, surtout, il confie aux lecteurs les clés de sa résilience et les recettes qui lui ont permis d&#39affronter l&#39adversité pour s&#39épanouir malgré la souffrance et atteindre ce plein potentiel qui se trouve à la portée de chacun d&#39entre nous.
Un livre bouleversant et stupéfiant qui a changé la vie de dizaines de milliers de lecteurs.",978-2377530670,https://m.media-amazon.com/images/I/81wEK7MtAyL._SY522_.jpg,NIMROD (28 septembre 2023),Biographies
Le Journal d&#39Anne Frank (Nouvelle édition),15.12,,978-2253937432,https://m.media-amazon.com/images/I/71DKiNxs0dL._SY522_.jpg,Le Livre de Poche; 1er édition (25 mai 2022),Biographies
"(Im)possible: Entre ombre et lumière, le combat d&#39une athlète hors du commun",6.59,Le parcours de résilience d’une personnalité hors du commun,979-1033914976,https://m.media-amazon.com/images/I/81OCa8Q+lvL._SY522_.jpg,HarperCollins (25 septembre 2024),Biographies
"Solo e&#39 il coraggio.Giovanni Falcone, il romanzo",5.32,"Un’esplosione squarcia la quiete della campagna corleonese. Il giovanissimo Totò Riina assiste allo sterminio dei suoi familiari intenti a disinnescare una bomba degli Alleati per ricavarne esplosivo. È un boato che distrugge e che genera. La piaga che molti, con timidi bisbigli, chiamano mafia, ma che d’ora in poi si rivelerà a tutti come Cosa nostra, s’incarna da qui in avanti nella sua forma più diabolica. Ma con potenza uguale e contraria, per fronteggiare l’onda di quella deflagrazione scaturisce anche il suo antidoto più puro. È il coraggio, quello che sorregge l’ingegno e l’intraprendenza, che sopperisce ai mezzi spesso insufficienti: il coraggio che scorre in Giovanni Falcone, negli uomini e nelle donne che insieme a lui sono pronti a lanciarsi in una battaglia furiosa dove la vita vale il prezzo di una pallottola. La storia di un magistrato che insieme a pochi altri intuisce la complessità di un’organizzazione criminale pervasiva, ne segue le piste finanziarie, ne penetra la psicologia e ne scardina la proverbiale omertà, è narrata in queste pagine con l’essenzialità di un dramma antico: sul proscenio, un uomo determinato a ottenere giustizia, assediato dai presagi più cupi, circondato dal coro dei colleghi che prima di lui sono caduti sotto il fuoco mafioso; stretto, nelle notti più buie, dall’abbraccio di una donna che ha scelto di seguirlo fino a dove il fato si compirà. Roberto Saviano ha voluto onorare la memoria del giudice palermitano strappandolo alla fissità dell’icona e ripercorrendone i passi, senza limitarsi a una ricostruzione fondata su uno studio attentissimo delle fonti, degli atti dei processi, delle testimonianze, ma spingendo la narrazione fino a quello “spazio intimo dove le scelte cruciali maturano prima di accadere”. Questo romanzo ci racconta una pagina fatidica della nostra storia, illumina la vita di un uomo che, nel pieno della carriera, fu in realtà al culmine del suo isolamento. E leva il canto altissimo della sua solitudine e del suo coraggio.",978-8830101685,https://m.media-amazon.com/images/I/71xSYKqj22L._SY522_.jpg,Bompiani (23 avril 2022),Biographies
J&#39écris l&#39Iliade,13.96,"Ce récit est souvent érotique. Quand il résiste à l&#39appel du désir, il écoute les voix des bêtes, des arbres, des pierres, de ceux qu&#39on a appelés les dieux - les voix de la guerre, aussi. L&#39amour et la guerre sont père et mère de tout récit, depuis le premier, qui est le Chant d&#39Homère. J&#39ai essayé d&#39entrevoir Homère dans ses antiques temps et lieux, mais aussi ici et maintenant. Le Chanteur inlassable hésite entre son époque et la nôtre, sans regret ni nostalgie, ni illusions. Avec étonnement peut-être. Il est aveugle, n&#39est-ce pas. Nous voit-il ? Homère est le héros de ce livre. P. M.",978-2070128075,https://m.media-amazon.com/images/I/71YWM0opcML._SY522_.jpg,GALLIMARD (6 février 2025),Biographies
"Dans mon regard, ton mépris: Une histoire vraie bouleversante",18.23,"L’homme dont vous allez lire le récit est tout l’inverse de ce que vous pourriez penser de lui. D’extérieur, il vit. À l’intérieur, c’est une tout autre histoire.
Derrière sa jovialité et son rire communicatif, il dissimule les traces indélébiles d’une jeunesse meurtrie par des propos humiliants et une éducation punitive poussée à l’extrême. Des traces qui font de lui ce qu’il est devenu.",979-8311214452,https://m.media-amazon.com/images/I/61nMcN6VvIL._SY522_.jpg,Independently published (20 février 2025),Biographies
Passion simple - Prix Nobel de Littérature 2022,15.39,"""À partir du mois de septembre l&#39année dernière, je n&#39ai plus rien fait d&#39autre qu&#39attendre un homme : qu&#39il me téléphone et qu&#39il vienne chez moi."" Annie Ernaux.",978-2930000015,https://m.media-amazon.com/images/I/7187tnYfsoL._SY522_.jpg,FOLIO; First Thus édition (4 janvier 1994),Biographies
Un enfant sans ombre,19.42,"Shaul Harel, alias Charlie Hilsberg, a perdu son ombre à l’âge de cinq ans, à la fin de 1942, lorsqu&#39il est séparé de sa famille, de son entourage et de sa langue maternelle.",979-8547546846,https://m.media-amazon.com/images/I/71Z1h-GFbWL._SY522_.jpg,Independently published (1 août 2021),Biographies
Bile Noire,11.59,,979-8308522164,https://m.media-amazon.com/images/I/71eLlYkfyVL._SY522_.jpg,Independently published (28 février 2025),Biographies
No Longer Human,17.25,The poignant and fascinating story of a young man who is caught between the breakup of the traditions of a northern Japanese aristocratic family and the impact of Western ideas.,978-0811204811,https://m.media-amazon.com/images/I/41alKvN9GwL._SY522_.jpg,New Directions Publishing Corporation; 1er édition (1 février 1973),Biographies
Augustine: Le récit d&#39un résilience,15.09,,979-8310255227,https://m.media-amazon.com/images/I/61w6a9sAGEL._SY522_.jpg,Independently published (17 février 2025),Biographies
Le cercle littéraire des amateurs d&#39épluchures de patates,6.24,,978-2264053510,https://m.media-amazon.com/images/I/71RpBtx378L._SY522_.jpg,10 X 18 (6 janvier 2011),Biographies
La dernière vague,19.79,"Cette dernière vague, je ne la verrai pas. Je ne l&#39entendrai pas. Je ne sais pas où elle est. Je ne sais pas quelle forme elle prendra mais je sais qu&#39elle existe et qu&#39elle viendra. Trop tard pour que je lui parle, trop tard pour que je l&#39écoute. Elle pourra toujours murmurer à l&#39oreille de ma femme, de mes enfants et de mes petits-enfants que l&#39amour est plus fort que la mort. Elle les rendra heureux comme je l&#39ai été. Aujourd&#39hui, je suis triste mais je n&#39ai pas peur. Ce qui compte, ce ne sont pas les années qu&#39il y a eu dans la vie, c&#39est la vie qu&#39il y a eu dans ces années. Et la mienne a été belle. Elle m&#39a emmené aux quatre coins du bonheur, de l&#39Agence France-Presse à Canal+, de TF1 à France Télévisions, de L&#39Équipe TV à beIN Sports. J&#39ai joué au foot avec Pelé, j&#39ai interviewé Tyson en prison, j&#39ai commenté la boxe avec Belmondo et Bouttier, j&#39ai été en larmes quand Ray Charles est venu chanter Georgia à Atlanta et bouleversé en vivant la mort des otages à Munich. J&#39ai vu grandir des journalistes talentueux qui rayonnent sur les ondes et qui m&#39accompagnent dans ce dernier combat. Je le perdrai mais que cette maladie de Charcot le sache, elle a affaire à un guerrier breton. Charles Biétry",978-2080470744,https://m.media-amazon.com/images/I/71LyaGS+Q+L._SY522_.jpg,FLAMMARION (29 janvier 2025),Biographies
Une vie de foot,15.98,"Elle appartient au club très fermé des Zidane, Guardiola, Cruyff ou Ancelotti, ses équivalents masculins. Ceux qui ont réussi sur le terrain et sur le banc des entraîneurs. Du foot de village au très haut niveau, Sonia Bompastor collectionne les premières fois. Lorsqu&#39en 1998, le centre de formation de Clairefontaine ouvre enfin ses portes aux femmes, elle figure parmi les pionnières. En 2011, elle soulève la Ligue des champions avec l&#39Olympique lyonnais dont elle est capitaine. Aucun club français n&#39avait réussi cet exploit auparavant. Dix ans plus tard, Sonia devient la première entraîneure de l&#39OL, la plus grande équipe féminine du monde, et remporte en 2022 la Ligue des champions : elle est ainsi la première femme à décrocher ce trophée en tant que coach et joueuse. En dépit des freins, du manque de moyens, de public ou de reconnaissance, Sonia Bompastor incarne avec ténacité l&#39émergence des femmes tant sur les terrains et que dans les yeux des supporters. Avec son parcours exceptionnel, la joueuse nous montre l&#39évolution du football féminin, en toute simplicité.",978-2080442215,https://m.media-amazon.com/images/I/71jYfke0rML._SY522_.jpg,ARTHAUD (19 février 2025),Biographies
Ma vie sans gravité,5.97,"Comment devient-on le plus jeune Français à partir vers la Station spatiale ? Comment passer de sa Normandie natale aux pas de tir de Baïkonour et de Cap Canaveral ? Pour la première fois, Thomas Pesquet se raconte sans détour, dans un récit très personnel aussi drôle que surprenant. Il nous entraîne des coulisses de l&#39école des astronautes jusqu&#39au frisson du décollage, partage le quotidien de ses 396 jours à bord de l&#39ISS et l&#39émerveillement de découvrir, flottant dans le vide intersidéral, notre planète si fragile. Une autobiographie aux allures de roman d&#39aventures, dont le héros est devenu l&#39une des personnalités préférées des Français.",978-2290405932,https://m.media-amazon.com/images/I/61DkuZjz5HL._SY522_.jpg,J&#39AI LU; Illustrated édition (30 octobre 2024),Biographies
"Das außergewöhnliche Leben eines Dienstmädchens namens PETITE, besser bekannt als Madame Tussaud",18.47,,978-3406739484,https://m.media-amazon.com/images/I/61SGNYM7AnL._SY522_.jpg,C.H. Beck (1 septembre 2019),Biographies
Une autobiographie,11.48,,978-2253118619,https://m.media-amazon.com/images/I/711pjB3uKVL._SY522_.jpg,Le Livre de Poche (5 septembre 2007),Biographies
Steve Jobs,12.21,,978-2253168522,https://m.media-amazon.com/images/I/71mmowWE5iL._SY522_.jpg,Le Livre de Poche; Reprint édition (3 octobre 2012),Biographies
La Statue intérieure,18.64,"""Je porte ainsi en moi, sculptée depuis l&#39enfance, une sorte de statue intérieure qui donne une continuité à ma vie, qui est la part la plus intime, le noyau le plus dur de mon caractère. Cette statue, je l&#39ai modelée toute ma vie. Je lui ai sans cesse apporté des retouches. Je l&#39ai affinée. Je l&#39ai polie. La gouge et le ciseau, ici, ce sont des rencontres et des combinaisons. Des rythmes qui se bousculent. Des feuillets égarés d&#39un chapitre qui se glissent dans un autre au calendrier des émotions"". François Jacob est professeur à l&#39Institut Pasteur et au Collège de France. Il a obtenu, avec André Lwoff et Jacques Monod, le prix Nobel de médecine, en 1965.",978-2738104717,https://m.media-amazon.com/images/I/61q4x04RXyL._SY522_.jpg,Odile Jacob (31 décembre 1996),Biographies
Un fragment de moi: Avec ... Contre ... Et Grâce à toi,19.07,,979-8309397655,https://m.media-amazon.com/images/I/61vipC4wpyL._SY522_.jpg,Independently published (25 février 2025),Biographies
"L’INCROYABLE VOYAGE DE MADAME BONBONS: Grand périple d’un amour inconditionnel qui jamais ne s’abîme ou ne s’oublie, … il se vénère se transmet et s’amplifie.",5.9,,978-2487297852,https://m.media-amazon.com/images/I/717r3vCqUqL._SY522_.jpg,EDITIONS ATIPIQUE (2 février 2025),Biographies
Le Livre de l&#39intranquillité,5.69,"Journal de bord de Fernando Pessoa,",978-2267047554,https://m.media-amazon.com/images/I/71gAdPqwUuL._SY522_.jpg,BOURGOIS (10 octobre 2024),Biographies
"Ma mère, Dieu et Litzie",17.66,Une leçon d&#39espoir et d&#39humanité qui célèbre l&#39amour et les liens qui nous unissent,978-2266344012,https://m.media-amazon.com/images/I/71gbzW4cP+L._SY522_.jpg,Pocket (24 octobre 2024),Biographies
Je sais pourquoi chante l&#39oiseau en cage,7.13,,978-2253127536,https://m.media-amazon.com/images/I/81uQNhJuz+L._SY522_.jpg,Le Livre de Poche (30 septembre 2009),Biographies
Ecrire un one-man-show et monter sur scène,8.99,,978-2212565102,https://m.media-amazon.com/images/I/71qAMZFm06L._SY522_.jpg,EYROLLES (18 août 2016),Biographies
Jean le bleu,5.44,"Dans ce récit autobiographique, Jean Giono évoque son enfance passée à Manosque, dans une maison haute avec un escalier étroit qui relie la blanchisserie du rez-de-chaussée, où s?active sa mère, Pauline, au troisième où se trouve l?atelier de cordonnier de son père. C?est là que Jean Giono a appris à sentir, à voir et à penser, sous la garde vigilante de sa mère, modelé par la sagesse et la grande bonté de son père. Jean Giono nous raconte aussi les aventures et les drames qui l?ont marqué et sa découverte de la sensualité au cours d?un séjour chez les bergers. C?est sur le départ pour la guerre de 1914 que s?achève ce merveilleux recueil de souvenirs d?enfance, empli de fraîcheur et de tendresse.",978-2253000228,https://m.media-amazon.com/images/I/91mTzWyzEqL._SY522_.jpg,Le Livre de Poche (1 janvier 1974),Biographies
Je veux vivre,17.95,,979-8306484587,https://m.media-amazon.com/images/I/71k4WVgY6CL._SY522_.jpg,Independently published (22 février 2025),Biographies
Trust (Pulitzer Prize Winner),12.36,"WINNER OF THE PULITZER PRIZE FOR FICTION

ONE OF",978-0593420324,https://m.media-amazon.com/images/I/910lg-mg-sL._SY522_.jpg,Riverhead Books (2 mai 2023),Biographies
Der gebrauchte Jude: Selbstporträt,14.94,,978-3596172610,https://m.media-amazon.com/images/I/61jpKRZETHL._SY522_.jpg,FISCHER Taschenbuch; 2. édition (11 février 2011),Biographies
Osée Josephine: La biographie intime de Joséphine Baker,14.16,"De Joséphine Baker, on connaît surtout l&#39artiste excentrique qui a rencontré le succès le succès dans les années 1920 dans La Revue Nègre. Pourtant, derrière cette image un peu frivole de chanteuse des Années Folles, il y a une femme bien plus complexe et profonde. Dans ce livre, l&#39auteur révèle une Joséphine Baker méconnue et intime. Une femme éprise de liberté, muse des peintres cubistes, mais aussi une grande résistante au service des Forces Françaises Libres. Militante anti-raciste, elle adopta douze enfants de toutes les nationalités et son engagement ne faiblira pas jusqu&#39à son dernier souffle. À travers des interviews inédites de la famille, c&#39est une grande figure de la France qui revit : une femme au destin exceptionnel qui a été de tous les combats. Avec passion et très en avance sur son temps.",978-2824619774,https://m.media-amazon.com/images/I/61ZscC7g+HL._SY522_.jpg,City Edition (19 janvier 2022),Biographies
Orwell ou l&#39horreur de la politique,14.57,"De George Orwell, le lecteur français connaît surtout le prophétique 1984, terrifiante description de la société totalitaire, et La Ferme des animaux, une satire féroce du monde soviétique. Pourtant, la vie et le travail du romancier britannique, mort en 1950, ne sauraient se résumer à ces deux chefs-d&#39oeuvre, aussi visionnaires soient-ils. Auteur prolifique, journaliste talentueux, militant jusqu&#39au bout, Orwell de sort vrai nom Eric Blair est une figure admirable et lucide. Armé d&#39un socialisme débarrassé ""de ses hypocrisies, de ses lâchetés et de ses sottises"", il a mené une lutte inlassable contre le totalitarisme. Et chez Orwell, les écrits sont cautionnés par les actes. Toute sa vie fut une quête tendue vers cet ""idéal d&#39un homme déterminé à tout prix à énoncer des vérités pas bonnes à dire"". Dans ce petit essai, initialement publié pour saluer la date orwellienne de 1984, Simon Leys décortique la théorie politique de cet écrivain majeur et tord le cou à un certain nombre d&#39idées reçues. En décryptant la double vocation d&#39Orwell (""écrivain politique""), il dessine en creux son autoportrait, celui d&#39un homme discret qui adhère à son oeuvre à chaque instant de son existence.",978-2081331419,https://m.media-amazon.com/images/I/61P2+UicQ+L._SY522_.jpg,FLAMMARION (12 mars 2014),Biographies
Victor Hugo (édition intégrale),15.5,,978-2374480060,https://m.media-amazon.com/images/I/71eNi0u6sUL._SY522_.jpg,XO (21 septembre 2017),Biographies
Mademoiselle Déjazet,17.82,"Treizième enfant d’une famille modeste, Virginie Déjazet débute sur les planches à l’âge de cinq ans. Le succès semble rapidement lui sourire, mais la presse et les rivalités sont redoutables sur le célèbre Boulevard du Crime…
Femme de tête et femme de cœur, elle se forge une devise ""Bien faire et laisser dire"". Mais la course à l’amour fou et au succès n’est pas sans écueils. Comment rester soi-même dans un milieu où la concurrence est rude et se joue dans le lit des directeurs de théâtre ?
Le rideau n’attend plus que vous pour se lever sur l’histoire vraie de Virginie Déjazet, la petite comédienne qui côtoya Rachel, Sarah Bernhardt et toute l’élite intellectuelle de son temps, avant d’être balayée par les soubresauts d’un siècle tourmenté.",978-2957252107,https://m.media-amazon.com/images/I/716FfftHrGL._SY522_.jpg,,Biographies
"Le Temps des Billes, des Confitures et du Saint-Esprit",10.86,"Dans ce roman d’inspiration autobiographique, nous suivons les tribulations d’Étienne Delgrade, douze ans en 1967. Sa dernière année de primaire à l’école Jean Monnet de Soyaux, ses vacances à la ferme en Charente et l’été suivant clôturent une fin de cycle, période délicieuse, heureuse et insouciante de son enfance. Au mois de septembre, il devait découvrir une nouvelle vie, parachuté en secondaire au collège Edmond Rostand.
L’auteur narre la métamorphose, les drôleries, les sentiments et les épreuves de ce jeune garçon aux portes de l’adolescence, qui mord la vie à pleines dents ! Tête en l’air, intrigué et intrigant, agité, sentimental, il serait aujourd’hui, sans doute, étiqueté hyperactif et dyslexique.
La fantaisie et les intrigues se mêlent dans des récits rythmés, entre souvenirs réels et imaginaires, au cœur de pensées sincères, qui auraient toutes pu exister et être authentiques !",979-8306191508,https://m.media-amazon.com/images/I/71dOcIAl11L._SY522_.jpg,Independently published (18 février 2025),Biographies
La vie meilleure,13.78,"""Nous sommes la somme de nos amours. Et c&#39est la seule chose qui restera de nous."" On l&#39a comparé à Gandhi, à Einstein, à Lénine. Des foules l&#39ont acclamé. Des milliardaires lui ont tapé sur l&#39épaule. Les damnés de la terre l&#39ont imploré. Aujourd&#39hui, son nom nous fait sourire, tout comme son invention : la méthode Coué. Singulier destin que celui d&#39Émile Coué, obscur pharmacien français devenu célébrité mondiale, tour à tour adulé et moqué. La vie meilleure retrace l&#39histoire de ce précurseur du développement personnel qui, au début du XXᵉ siècle, pensait avoir découvert les clés de la santé et du bonheur. Un homme sincère jusque dans sa roublardise, qui croyait plus que tout au pouvoir des mots et de l&#39imagination. Avec ce roman lumineux aux accents intimes, Étienne Kern rend hommage à ceux qui cherchent coûte que coûte une place pour la joie.",978-2073075833,https://m.media-amazon.com/images/I/81bQ1z-uCIL._SY522_.jpg,Gallimard; 1er édition (22 août 2024),Biographies
"RAYONNANTE: Les clés d&#39une vie épanouie pour oser être soi I Un parcours de pleine conscience, de spiritualité et de bien-être",13.24,Et si vous arrêtiez enfin de prétendre que tout va bien ?,979-8301936579,https://m.media-amazon.com/images/I/6154CNoi7zL._SY522_.jpg,Independently published (15 mai 2024),Biographies
La pantera,7.56,"Brillanti, colti, belli, Charles e Edward Detmold sono la speranza dell’arte inglese, tra i grandi disegnatori del secolo scorso. Gemelli, il loro capolavoro è il carnet di illustrazioni per un’edizione di pregio del Libro della giungla, del 1903. Inaspettatamente, al culmine della fama, Charles, nel 1908, a 24 anni, si uccide. Edward continuerà a realizzare opere di pregio – le illustrazioni agli Arabian Nights, ad esempio – ma la morte del fratello sconvolge le sue energie: finirà per chiudersi in una cupa solitudine, dai tardi anni Venti, insieme alla sorella, Sarah, divenuta vedova. Si ucciderà anche lui, Edward, sigillando la scelta drastica del fratello, cinquant’anni dopo, nel 1957. Il romanzo si snoda tra i meandri dei rapporti obliqui tra gemelli, insinuando amori incestuosi, nel bel mondo dell’Inghilterra di allora. Appaiono, creature fugaci, Rudyard Kipling e T.H. Lawrence, Karen Blixen e Vladimir Nabokov; per lo più, il romanzo s’incentra sui legami ossessivi, sonda l’enigma dell’arte, il desiderio della gloria adombrato dal gusto per la dissipazione.",979-1280987297,https://m.media-amazon.com/images/I/51f1++SYPiL._SY522_.jpg,Industria & Letteratura (6 mars 2024),Biographies
François Mauriac. Biographie intime,12.18,"François Mauriac est un des écrivains les plus engagés dans l’histoire littéraire, spirituelle et politique du xx",978-2818504956,https://m.media-amazon.com/images/I/81Lr-SCQXbL._SY522_.jpg,Fayard/Pluriel (4 novembre 2015),Biographies
Balzac,7.42,,978-2253139256,https://m.media-amazon.com/images/I/71sSn2deFpL._SY522_.jpg,Le Livre de Poche; Le Livre de Poche édition (1 mars 1996),Biographies
Une chanson d&#39amour à Auschwitz: Le pouvoir de l&#39amour dans l&#39endroit le plus sombre du monde,15.28,SEUL L&#39AMOUR PEUT ÉCLAIRER L&#39ENDROIT LE PLUS SOMBRE DE LA TERRE,979-8346025733,https://m.media-amazon.com/images/I/61k0LGtPYvL._SY522_.jpg,Independently published (9 novembre 2024),Biographies
Rinascimento privato,14.83,"In queste pagine si racconta la vicenda di Isabella d&#39Este, divenuta marchesa di Mantova dopo il matrimonio con Francesco Gonzaga; non di una semplice per quanto raffinata biografia si tratta, però, quanto di un vero e proprio romanzo: sia per la presenza di alcuni personaggi totalmente inventati - come Robert de la Pole, corrispondente del re d&#39inghilterra e innamorato platonico di Isabella -, sia soprattutto per la qualità della scrittura, che sembra avvolgere in una sorta di abbagliante pulviscolo ogni figura e ogni fatto storico. Protagonista assoluta è lei, Isabella, che ormai alla soglia dei sessant&#39anni rievoca la propria vita da quando, sposa sedicenne, giunse a Mantova e in un periodo tra i più tumultuosi e fulgidi della nostra storia, a cavallo tra Quattro e Cinquecento, resse le fila del piccolo stato costruendo attorno a sé una corte di ineguagliato splendore.",978-8804668312,https://m.media-amazon.com/images/I/81zhdSc793L._SY522_.jpg,Mondadori (24 mai 2016),Biographies
La vie et les voyages du Capitaine Cook: Nouvelle édition illustrée,6.0,,978-2494653412,https://m.media-amazon.com/images/I/71akkahJWeL._SY522_.jpg,A. de la Pinsonnais (13 octobre 2024),Biographies
,16.87,,,,,Biographies
