Nom,Prix,Description,Isbn,Photo,Editeur,Categorie
Que peut Littérature quand elle ne peut ?,18.42,,978-2021588927,https://m.media-amazon.com/images/I/41d9s5C25mL.jpg,SEUIL (7 février 2025),Correspondances et memoires
Anne Frank - L&#39Intégrale,12.43,,978-2702161722,https://m.media-amazon.com/images/I/51iPHuJQ4ML._SY445_SX342_.jpg,Calmann-Lévy; Illustrated édition (4 octobre 2017),Correspondances et memoires
Le cercle des obligés: Roman,7.88,"Automne 1968, dans une décharge des Yvelines, Stefan Markovic, homme à tout faire et doublure d’Alain Delon, est retrouvé mort, ligoté dans une housse de matelas, le visage détruit et une balle dans la nuque. Automne 1993, sur le parking d’une résidence, le long des marais salants de la presqu’île de Giens, Henri Diana, grande figure du Milieu varois, est assassiné.
Vingt-cinq années, deux morts, et un peu de sable blanc de la côte d’Azur comme piste oubliée.
Ainsi commence",978-2246841425,https://m.media-amazon.com/images/I/41A+mkqzSsL._SY445_SX342_.jpg,Grasset (8 janvier 2025),Correspondances et memoires
"Le Capital, Livre I",16.85,"""J&#39étudie dans cet ouvrage le mode de production capitaliste et les rapports de production et d&#39échange qui lui correspondent. [...] Il ne s&#39agit point ici du développement plus ou moins complet des antagonismes sociaux qu&#39engendrent les lois naturelles de la production capitaliste, mais de ces lois elles-mêmes, des tendances qui se manifestent et se réalisent avec une nécessité de fer. Au premier abord, la marchandise nous est apparue comme quelque chose à double face, valeur d&#39usage et valeur d&#39échange. Ensuite nous avons vu que tous les caractères qui distinguent le travail productif de valeurs d&#39usage disparaissent dès qu&#39il s&#39exprime dans la valeur proprement dite. J&#39ai le premier mis en relief ce double caractère du travail représenté dans la marchandise. [...] Tant qu&#39elle est bourgeoise, c&#39est-à-dire tant qu&#39elle voit dans l&#39ordre capitaliste, non une phase transitoire du progrès historique, mais bien la forme absolue et définitive de la production sociale, l&#39économie politique ne peut rester une science qu&#39à condition que la lutte des classes demeure latente ou ne se manifeste que par des phénomènes isolés."" Karl Marx.",978-2070355747,https://m.media-amazon.com/images/I/81ZiOatNr1L._SY522_.jpg,FOLIO ESSAIS (5 juin 2008),Correspondances et memoires
C&#39était de Gaulle,14.33,"Alain Peyrefitte a eu, entre 1959 et 1969, quelque 300 entretiens en tête à tête avec le général de Gaulle. Auxquels s&#39ajoutent les conseils des ministres, les conseils restreints, les rencontres avec des chefs d&#39État ou de gouvernement étrangers. Pendant toute cette période, il a pris des notes au jour le jour, avec l&#39accord du Général. Ces notes, ce sont essentiellement les propos tenus par le Général, scrupuleusement recueillis, dans l&#39intention de les soustraire à l&#39oubli, en respectant non seulement leur teneur, mais aussi le style et le ton des dialogues. La transcription fidèle de ces notes, classées thématiquement pour la publication, produit un effet saisissant : le lecteur voit surgir et retrouve dans toute l&#39intensité de sa présence le personnage exceptionnel que fut de Gaulle. Peyrefitte nous introduit dans l&#39intimité du Général que nous écoutons penser tout haut. C&#39est un de Gaulle en liberté, qui va beaucoup plus loin que dans ses textes officiels et s&#39exprime avec une familiarité et une franchise surprenantes. Par la richesse et la diversité des révélations qu&#39il apporte, et le portrait intellectuel et moral qui s&#39en dégage, ce volume constitue un témoignage capital sur celui qui compte parmi les derniers héros et les grands mythes de l&#39histoire nationale.",978-2070765065,https://m.media-amazon.com/images/I/91eBDriTMML._SY522_.jpg,Gallimard (20 février 2002),Correspondances et memoires
Antidote au culte de la performance: La robustesse du vivant,7.79,"""La nature menacée devient menaçante : notre excès de contrôle nous a fait perdre le contrôle. Il va maintenant falloir vivre dans un monde fluctuant, c&#39est-à-dire inventer la civilisation de la robustesse, contre la performance."" Olivier Hamant Face aux bouleversements du monde en cours et à venir, le développement durable, entre géo-ingénierie contreproductive et tout-électrique mal pensé, crée de nombreux futurs obsolètes. Émergent alors les contremodèles de la décroissance et de la sobriété heureuse, nettement mieux alignés avec le monde qui vient. Mais la frugalité peut-elle réellement mobiliser ? Ne risque-t-elle pas non plus de se réduire à d&#39autres formes d&#39optimisation ? Et si, pour être sobre et durable, il fallait d&#39abord questionner une valeur nettement plus profonde : l&#39efficacité. Le monde très fluctuant qui vient appelle un changement de civilisation. Ce chemin demande surtout de valoriser nos points faibles et inverse toutes les recettes.",978-2073047342,https://m.media-amazon.com/images/I/71C8NIzsqIL._SY522_.jpg,GALLIMARD (31 août 2023),Correspondances et memoires
Découvrez vos pouvoirs de guérisseur,18.87,"Maux de ventre, brûlures, stress, règles douloureuses, problèmes de peau, troubles du sommeil… Christophe Limayrac et Anne Ghiringhelli dévoilent des techniques de guérisseur simples et efficaces pour traiter 101 maux du quotidien. Car oui, magnétiser s’apprend ! Pas besoin de rite ou d’initiation, vous avez les ressources en vous.

Ce livre enrichi de nombreux schémas et exercices met à votre disposition une véritable trousse de secours et vous montrera comment :

• Apprivoiser votre magnétisme
• Acquérir les gestes de bases
• Pratiquer des soins sur vous et votre entourage... et même sur vos animaux de compagnie !

+ DES VIDÉOS POUR ADOPTER LES BONS GESTES",978-2035961679,https://m.media-amazon.com/images/I/71zhzH9Vo+L._SY522_.jpg,Larousse (17 avril 2019),Correspondances et memoires
Éloge de la fuite,18.58,""" Se révolter, c&#39est courir à sa perte, car la révolte, si elle se réalise en groupe, retrouve aussitôt une échelle hiérarchique de soumission à l&#39intérieur du groupe, et la révolte, seule, aboutit rapidement à la soumission du révolté... Il ne reste plus que la fuite. "" Henri Laborit pose, à la lumière des découvertes biologiques, la question de notre libre arbitre, de notre personnalité même. La politique, la société, tout prend dès lors une autre dimension.",978-2070322831,https://m.media-amazon.com/images/I/81RXAPGCGPL._SY522_.jpg,FOLIO ESSAIS (12 février 1985),Correspondances et memoires
Antifragile: Les bienfaits du désordre,8.71,[FORMAT POCHE],978-2251451350,https://m.media-amazon.com/images/I/51VMBtUnWYL._SY522_.jpg,Belles Lettres; 1er édition (10 septembre 2020),Correspondances et memoires
"Baby clash, devenir parents sans s&#39étriper !",5.72,"« On peut s’aimer très fort, se respecter par-delà les montagnes, l’arrivée d’un enfant est un chamboulement tel que la branche est susceptible de craquer. Il ne faut pas en avoir honte ni imaginer qu’on a foiré nos plantations. On est simplement comme tout le monde : l’enfant est là, ce n’est pas toujours simple, et notre couple se démerde comme il peut. »",978-2036043657,https://m.media-amazon.com/images/I/71hq3R4AZ3L._SY522_.jpg,Larousse (3 janvier 2024),Correspondances et memoires
Factfulness: Penser clairement ça s&#39apprend !,14.5,"Nous nous croyons rationnels et informés. Ce n&#39est pas le cas. Nous nous trompons systématiquement, quel que soit notre niveau d&#39études, y compris - peut-être même plus - sur les sujets que nous croyons bien connaître. Mais, comme le met au jour Hans Rosling, statisticien de génie et star des conférences TED, les raisons pour lesquelles nous nous trompons sont toujours les mêmes ! Hérité d&#39un ancestral instinct de survie, c&#39est le fonctionnement même de notre cerveau qui nous induit en erreur : En nous incitant à chercher un coupable à tout phénomène ; En résumant la plupart des problèmes en une stérile opposition binaire ; En nous intimant de réagir dans l&#39urgence (confondant ainsi peur et danger), En étant facilement ébloui par les gros chiffres ; En dramatisant à l&#39excès (et en adorant ça)... Ce livre nous apprend à repérer les situations où nos biais de pensée déforment notre vision des choses. Indispensable pour comprendre le monde tel qu&#39il est, Factfulness permet de prendre, enfin, la saine habitude de ne fonder son opinion que sur des faits.",978-2081427112,https://m.media-amazon.com/images/I/71Q1wF9LtLL._SY522_.jpg,FLAMMARION; Illustrated édition (13 février 2019),Correspondances et memoires
Le génocide voilé: Enquête historique,11.68,"Cette étude éclaire un drame passé à peu près inaperçu : la traite des Noirs d&#39Afrique par le monde arabo-musulman. Cette traite a concerné dix-sept millions de victimes tuées, castrées ou asservies, pendant plus de treize siècles sans interruption. Les razziés étaient contraints de traverser le désert à pied pour rejoindre le Maghreb, l&#39Égypte ou la péninsule Arabique via Zanzibar, par bateaux... Pourtant, cette traite négrière a été minimisée, contrairement à la traite occidentale vers l&#39Amérique. Pourquoi ? Parce que seule la conversion à l&#39islam permettait d&#39échapper à l&#39esclavage, mais n&#39a pas épargné les Noirs. Toutefois, de nos jours la majeure partie de l&#39Afrique est devenue musulmane, d&#39où une forme de fraternité religieuse entre le côté ""blanc"" et le côté ""noir"" du continent, et une volonté commune de ""voiler"" ce génocide. Un livre polémique et courageux.",978-2072718496,https://m.media-amazon.com/images/I/518qVpthPDL._SY445_SX342_.jpg,FOLIO (9 mars 2017),Correspondances et memoires
Le cygne noir: La puissance de l&#39imprévisible - Suivi de Force et fragilité - Réflexions philosophiques et empiriques,18.98,,978-2251451367,https://m.media-amazon.com/images/I/4171pTf0sNL._SY445_SX342_.jpg,Belles Lettres; 1er édition (10 septembre 2020),Correspondances et memoires
Vous avez le pouvoir de vous guérir: Stimulez vos capacités d&#39auto-guérison avec la médecine énergétique,12.11,LA MÉDECINE ÉNERGÉTIQUE À LA PORTÉE DE TOUS,978-2035989499,https://m.media-amazon.com/images/I/71lEXgRVxUL._SY522_.jpg,Larousse (14 avril 2021),Correspondances et memoires
Marseille 1940: Quand la littérature s&#39évade,13.93,Après le succès de,978-2246838364,https://m.media-amazon.com/images/I/81uaby1kxbL._SY522_.jpg,Grasset; Illustrated édition (5 février 2025),Correspondances et memoires
Simulacres et simulation,5.48,"Dans cet essai, Jean Baudrillard promène un oeil critique sur les artefacts du monde contemporain. Des parcs d&#39attractions californiens et de leur promesse de ressusciter l&#39enfance au Forum des Halles parisien, ""sarcophage de la marchandise"", en passant par des prouesses biotechnologiques comme le clonage, l&#39auteur questionne notre rapport à la reproduction tous azimuts des images et des choses. Il entrevoit alors un nouveau régime des simulacres dans lequel le réel n&#39a pas fini d&#39être aboli. ""Cette course au réel et à l&#39hallucination réaliste est sans issue car, quand un objet est exactement semblable à un autre, il ne l&#39est pas exactement, il l&#39est un peu plus. Il n&#39y a jamais de similitude, pas plus qu&#39il n&#39y a d&#39exactitude. Ce qui est exact est déjà trop exact, seul est exact ce qui s&#39approche de la vérité sans y prétendre"".",978-2073039590,https://m.media-amazon.com/images/I/61w91nrkWxL._SY522_.jpg,GALLIMARD (13 juin 2024),Correspondances et memoires
Le post-partum dure 3 ans,18.94,"Vous avez toujours entendu dire que le post-partum s’étendait de l’accouchement au retour des règles ? Vous culpabilisez de ne pas avoir encore retrouvé votre corps et votre énergie d’avant bébé ?
Rassurez-vous, après des années d’expérience comme sage-femme, Anna Roy l’affirme haut et fort : cette période ne dure pas 3 mois… mais 3 ans !

Dans cet ouvrage, elle vous invite à relâcher la pression et réunit ses meilleurs conseils pour mieux vivre cette période tant au niveau psychique que physique.

Et parce que le post-partum n’est pas qu’une question de baby blues ou de kilos en trop, l’autrice souhaite également faire entendre sa voix en proposant des mesures juridiques et sociales indispensables au bien-être des femmes : personnel soignant supplémentaire, allongement du congé maternité, plan de retour au travail, meilleure prévention de la dépression post-partum…

Véritable poing sur la table, ce livre bouillonne d’idées pour accompagner au mieux les parents dans cette épopée.",978-2036028418,https://m.media-amazon.com/images/I/71Gd-e2e0sL._SY522_.jpg,Larousse (4 janvier 2023),Correspondances et memoires
De la tyrannie: Vingt leçons du XXᵉ siècle,19.24,"Entamé au lendemain de l&#39élection de Donald Trump, ce texte se présente comme un guide de résistance, proposant aux Américains - mais aussi à l&#39Europe - un bref catalogue d&#39idées pour préserver les libertés dans les années à venir. En vingt chapitres didactiques, l&#39historien explique les parallèles entre la situation actuelle aux États-Unis et l&#39histoire de l&#39Europe du XXᵉ siècle. Snyder propose une série de préceptes élémentaires : ne pas faire preuve d&#39obéissance anticipée, protéger les institutions, faire attention aux mots et s&#39élever contre l&#39usage dévoyé des termes patriotiques, chercher la vérité des faits, refuser l&#39État de parti unique, se sentir responsable du monde... Ce bréviaire tonique pour temps difficiles est fort utile pour comprendre l&#39avènement de Donald Trump et lutter contre la montée en force des extrémismes en Europe.",978-2072742521,https://m.media-amazon.com/images/I/71++7o+hLOL._SY522_.jpg,Gallimard (12 octobre 2017),Correspondances et memoires
Les routes de la liberté,13.65,"Le libéralisme de nos sociétés contemporaines serait-il en train de tuer nos libertés individuelles et collectives ? Au nom même de la liberté, les néolibéraux et leurs alliés de droite radicale enchaînent les mesures politiques et économiques qui la restreignent. Ces échecs ont poussé beaucoup d’insatisfaits à se tourner vers le populisme et des figures comme Donald Trump, Jair Bolsonaro ou encore Narendra Modi. Comment en sommes-nous arrivés là ?

S’attaquant à des géants de l’économie tels que Friedrich Hayek et Milton Friedman, le célèbre prix Nobel Joseph Stiglitz décrypte les conséquences du néolibéralisme, critiquant vigoureusement les dogmes économiques contemporains et l’influence des idéologies néolibérales sur les médias et l’éducation. L’économiste dénonce ainsi les idées reçues sur les marchés prétendument « libres » qui, au lieu de favoriser une prospérité générale, exacerbent les inégalités et concentrent la richesse entre les mains d’une élite minoritaire. Un essai d’une actualité brûlante qui ouvre de nouveaux horizons critiques et encourage à se réapproprier la notion de liberté.",979-1020923479,https://m.media-amazon.com/images/I/51rDz8TqRqL._SY522_.jpg,Les Liens qui Libèrent (8 janvier 2025),Correspondances et memoires
L&#39étrange défaite,14.81,Nouvelle édition,978-2070325696,https://m.media-amazon.com/images/I/41pjH4PGZeL._SY445_SX342_.jpg,FOLIO HISTOIRE (1 janvier 1990),Correspondances et memoires
Les chrétiens d&#39Orient et la France: mille ans d&#39une passion tourmentée,12.11,"Préface de Jean-François Colosimo Le christianisme va-t-il mourir là même où il est né ? La France, pourtant protectrice des chrétiens d&#39Orient depuis un millénaire, les aurait-elle abandonnés ? Le sort des bâtisseurs de la civilisation dont nous sommes les héritiers représente un enjeu vital, une pièce du puzzle tout à fait déterminante pour la stabilité de la région et pour l&#39équilibre mondial. C&#39est un roman vrai, sans doute l&#39une des sagas les plus étonnantes et les plus tragiques de notre temps que Carine Marret retrace dans ce livre, mêlant la chronique historique à l&#39essai, tout en convoquant l&#39art et la littérature. L&#39auteur donne ainsi les clefs pour déchiffrer les enjeux existentiels et géopolitiques qui se jouent au Moyen-Orient, dont les conséquences se font ressentir dans le monde entier et a fortiori en France, pays qui a construit une longue histoire humaine et diplomatique avec les chrétiens des origines. Une lecture passionnante pour rappeler les faits, dissiper les idées reçues et mieux comprendre les défis du monde d&#39aujourd&#39hui.",978-2940719754,https://m.media-amazon.com/images/I/51sOdfUwBeL._SY445_SX342_.jpg,BALLAND (30 janvier 2025),Correspondances et memoires
Danser sur le volcan: La mode et le luxe à la conquête de nos imaginaires,16.97,"Vous pouvez désormais dîner « Dior », voir un film « Saint Laurent », dormir « Armani » ou lire « Chanel ». Les maisons de mode et de luxe ne se contentent plus de vendre des sacs, du prêt-à-porter et du rouge à lèvres, elles investissent les sphères d’influence les plus symboliques – la culture, l’art, le sport, le monde universitaire ou la géopolitique.
Des slogans féministes utilisés pendant les défilés à la fourniture de matériel contre le Covid-19 en passant par le mécénat culturel, les géants du luxe s’éloignent progressivement d’un simple discours commercial pour proposer des visions du monde. L’art de vivre à la française et l’artisanat d’excellence cohabitent à présent avec le rythme effréné des fashion weeks, brouillant ainsi les frontières entre tradition, création et consommation.
Aussi critiqués que convoités, superficiels que profonds, la mode et le luxe cultivent l’art des paradoxes dans un contexte d’inquiétudes sociales et environnementales. Dans cette enquête saisissante, Sophie Abriat observe de l’intérieur ce monde de vanités et de rêves, grâce auquel il est encore possible de « danser sur le volcan ». Un livre qui offre une plongée inédite dans un univers réputé impénétrable.",978-2246836643,https://m.media-amazon.com/images/I/41t2vXwzqCL._SY445_SX342_.jpg,Grasset (15 janvier 2025),Correspondances et memoires
De l&#39inégalité parmi les sociétés: Essai sur l&#39homme et l&#39environnement dans l&#39histoire,5.03,"Pourquoi une telle domination de l&#39Eurasie dans l&#39histoire ? Pourquoi ne sont-ce pas les indigènes d&#39Amérique, les Africains et les aborigènes australiens qui ont décimé, asservi et exterminé les Européens et les Asiatiques ?L&#39inégalité dans la répartition des richesses entre les sociétés est liée aux différences de milieux, pas aux différences génétiques.Mobilisant des disciplines aussi diverses que la génétique, la biologie moléculaire, l&#39écologie des comportements, l&#39épidémiologie, la linguistique, l&#39archéologie et l&#39histoire des technologies, Jared Diamond montre notamment : - le rôle de la production alimentaire (c&#39est-à-dire la domestication des plantes et des animaux sauvages, puis l&#39augmentation des vivres par l&#39agriculture et l&#39élevage, qui permet d&#39entretenir des bureaucraties et des artisans spécialisés dans la production des armes) ;- l&#39évolution des germes caractéristiques des populations humaines denses favorisées par la révolution agricole (les germes eurasiens ont tué plus d&#39indigènes américains et non eurasiens que les fusils ou les armes d&#39acier des Eurasiens) ;- le rôle de la géographie dans la diffusion contrastée de l&#39écriture et de la technologie, selon la latitude en Eurasie, mais la longitude aux Amériques et en Afrique.À l&#39ère de la globalisation, Jared Diamond nous propose opportunément cet essai, en tout point singulier, sur l&#39origine et les fondements de l&#39inégalité parmi les sociétés.",978-2070347506,https://m.media-amazon.com/images/I/71QkQf2uudL._SY522_.jpg,FOLIO ESSAIS (27 septembre 2007),Correspondances et memoires
L&#39armée des ombres,8.61,,978-2020060691,https://m.media-amazon.com/images/I/31WNMRX1dAL._SY445_SX342_.jpg,Pocket (11 mai 2001),Correspondances et memoires
"Bordel, soyons libres !: 7 secrets pour vivre une vie puissante et affranchie",18.15,"Je m&#39appelle Harmony, j&#39ai 33 ans et j&#39ai purgé ma peine.",978-2036055469,https://m.media-amazon.com/images/I/71dOkAALp3L._SY522_.jpg,Larousse; Illustrated édition (10 avril 2024),Correspondances et memoires
Le Dernier voyage de Momoko Hidaka,12.55,,978-2493816467,https://m.media-amazon.com/images/I/71WZBURf-vL._SY522_.jpg,NAMI (21 août 2024),Correspondances et memoires
Les Lettres qataries,19.23,,978-2226493422,https://m.media-amazon.com/images/I/61P+xX+NlBL._SY522_.jpg,Albin Michel (22 janvier 2025),Correspondances et memoires
"Système 1, système 2 : Les deux vitesses de la pensée",6.89,"Comment prenons-nous nos décisions ? Qu&#39est-ce qui guide nos préférences et nos jugements ? Quand faut-il faire confiance à notre intuition ? Tels sont les fils rouges de cet ouvrage, dans lequel Daniel Kahneman nous emmène à la rencontre étonnante des deux ""personnages"" qui se partagent notre esprit.Le ""Système 1"" est rapide, intuitif et émotionnel ; le ""Système 2"" est lent, réfléchi et logique. Via de multiples expériences auxquelles le lecteur est invité à s&#39essayer lui-même, Daniel Kahneman expose les ravages des partis pris et autres biais cognitifs dont nous sommes les jouets : illusion de familiarité, effet de halo, biais optimiste, effet d&#39ancrage...Fruit de toute une vie de recherche, Système 1 / Système 2 dessine une théorie brillante qui offre des prolongements pratiques immédiats dans la vie quotidienne et professionnelle.",978-2081307827,https://m.media-amazon.com/images/I/61Ll4raDHRL._SY445_SX342_.jpg,FLAMMARION (24 février 2016),Correspondances et memoires
Terre brisée,14.97,,978-2385294076,https://m.media-amazon.com/images/I/915SuLdRUSL._SY522_.jpg,CHARLESTON (6 mars 2025),Correspondances et memoires
L&#39enracinement: Prélude à une déclaration des devoirs envers l&#39être humain,13.57,"""L&#39enracinement est peut-être le besoin le plus important et le plus méconnu de l&#39âme humaine. C&#39est un des plus difficiles à définir. Un être humain a une racine par sa participation réelle, active et naturelle à l&#39existence d&#39une collectivité qui conserve vivants certains trésors du passé et certains pressentiments d&#39avenir. Participation naturelle, c&#39est-à-dire amenée automatiquement par le lieu, la naissance, la profession, l&#39entourage. Chaque être humain a besoin d&#39avoir de multiples racines. Il a besoin de recevoir la presque totalité de sa vie morale, intellectuelle, spirituelle, par l&#39intermédiaire des milieux dont il fait naturellement partie."" Simone Weil.",978-2070325634,https://m.media-amazon.com/images/I/81I8vqFsEPL._SY522_.jpg,Gallimard (2 mars 1990),Correspondances et memoires
Les Perversions narcissiques,18.37,"Quel est le secret du pervers narcissique ? A-t-il une vie intérieure ? Comment agit-il ? Est-il toujours seul ? Que ne supporte-t- il pas ? Si l’on parle aujourd’hui de la perversion narcissique, c’est grâce à Paul-Claude Racamier. Le premier, il en a révélé l’existence et décrit le fonctionnement. Il savait de quoi il parlait : lui-même victime de pervers narcissiques dans l’institution psychiatrique qu’il dirigeait, il fait émerger dans ces pages puissantes et imagées un être glaçant, homme ou femme, qui adopte la stratégie du coucou pour se débarrasser de sa propre souffrance.",978-2228934404,https://m.media-amazon.com/images/I/51IZVaRBflL._SY445_SX342_.jpg,Payot (11 octobre 2023),Correspondances et memoires
Les Perversions narcissiques,10.68,"Quel est le secret du pervers narcissique ? A-t-il une vie intérieure ? Comment agit-il ? Est-il toujours seul ? Que ne supporte-t- il pas ? Si l’on parle aujourd’hui de la perversion narcissique, c’est grâce à Paul-Claude Racamier. Le premier, il en a révélé l’existence et décrit le fonctionnement. Il savait de quoi il parlait : lui-même victime de pervers narcissiques dans l’institution psychiatrique qu’il dirigeait, il fait émerger dans ces pages puissantes et imagées un être glaçant, homme ou femme, qui adopte la stratégie du coucou pour se débarrasser de sa propre souffrance.",978-2228934404,https://m.media-amazon.com/images/I/51IZVaRBflL._SY522_.jpg,Payot (11 octobre 2023),Correspondances et memoires
